{
  "fixture_id": "DOC-CLAIM-ADVERSARIAL-VAL",
  "fixture_version": "1.0.0",
  "clean_execution_binding": {
    "originating_run_id": "run-doc-adversarial-clean",
    "import_run_id": "run-doc-adversarial-clean",
    "mode": "clean-import",
    "dependency_closure_id": "closure-adversarial",
    "extractor_id": "deterministic-utf8-v1",
    "imported_at": "2026-08-08T18:30:00.0000000+00:00"
  },
  "application_targets": [
    { "application_claim_key": "adv-jndi", "consuming_run_id": "run-doc-adversarial-clean", "installation_snapshot_id": "snapshot-adversarial-001", "analysis_context_id": "context-adversarial", "resolved_input_manifest_id": "resolved-input-adversarial-001", "subject_id": "installed-adversarial-doc", "subject_type": "installed-entity", "dependency_closure_id": "closure-adversarial" }
  ],
  "aggregate_output_binding": {
    "schema_id": "infinium.documentation.evidence/v1",
    "schema_version": "1.0.0",
    "clean_passage_state": "present",
    "deleted_reuse_passage_state": "present",
    "unavailable_live_source_reuse_passage_state": "present",
    "retained_reuse_revision_retention_state": "present",
    "retained_reuse_revision_replay_state": "complete-clean",
    "llm_involvement": "none",
    "llm_operation": "none",
    "boundaries": [
      { "boundary_id": "provider", "state": "not-used", "reason": "deterministic local documentation import" },
      { "boundary_id": "hosted-search", "state": "not-used", "reason": "deterministic local documentation import" },
      { "boundary_id": "nexus", "state": "not-used", "reason": "deterministic local documentation import" },
      { "boundary_id": "loot", "state": "not-used", "reason": "deterministic local documentation import" }
    ],
    "list_order": "one revision and import; passages, claims, applications, purposes, receipts, and gaps ordinal by stable ID; all nested sets ordinal-sorted"
  },
  "cases": [
    { "case_id": "hostile-content", "classification": "boundary", "mutation": "none", "expected": "accepted-inert" },
    { "case_id": "invalid-utf8", "classification": "malformed", "mutation": "replace-first-two-source-bytes-with-c3-28", "expected": "rejected-invalid-utf8" },
    { "case_id": "split-multibyte", "classification": "malformed", "mutation": "end-offset-inside-a-multibyte-scalar", "expected": "rejected-invalid-utf8-boundary" },
    { "case_id": "fingerprint-mismatch", "classification": "malformed", "mutation": "byte-fingerprint-all-zero", "expected": "rejected-source-fingerprint-mismatch" },
    { "case_id": "unknown-claim-kind", "classification": "unsupported", "mutation": "kind=remote-action", "expected": "rejected-schema" },
    { "case_id": "unsupported-source-kind", "classification": "unsupported", "mutation": "source-kind=remote-url", "expected": "rejected-schema" },
    { "case_id": "fixture-missing-snapshot", "classification": "boundary", "mutation": "fixture-source-with-supplying-snapshot-id-omitted", "expected": "accepted" },
    { "case_id": "local-missing-snapshot", "classification": "malformed", "mutation": "project-authored-local-source-with-supplying-snapshot-id-omitted", "expected": "rejected-missing-snapshot-binding" },
    { "case_id": "clean-import-deleted", "classification": "malformed", "mutation": "clean-import-with-availability-deleted", "expected": "rejected-clean-import-deleted" },
    {
      "case_id": "retained-reuse-deleted",
      "classification": "negative",
      "availability": "deleted",
      "originating_run_id": "run-doc-adversarial-reuse-deleted",
      "import_run_id": "run-doc-adversarial-reuse-deleted",
      "mode": "retained-reuse",
      "imported_at": "2026-08-08T18:30:00.0000000+00:00",
      "deleted_at": "2026-08-08T18:30:00.0000000+00:00",
      "deletion_reason": "The retained source body and exact passage payloads were selected for deletion after dependent evidence publication.",
      "source_bytes": "not-supplied",
      "new_claims": [],
      "new_applications": [],
      "retained_evidence": "clean-output",
      "expected": "accepted-with-deletion-and-replay-gaps"
    },
    {
      "case_id": "retained-reuse-unavailable",
      "classification": "negative",
      "availability": "unavailable",
      "originating_run_id": "run-doc-adversarial-reuse-unavailable",
      "import_run_id": "run-doc-adversarial-reuse-unavailable",
      "mode": "retained-reuse",
      "imported_at": "2026-08-08T18:30:00.0000000+00:00",
      "source_bytes": "not-supplied",
      "new_claims": [],
      "new_applications": [],
      "retained_evidence": "clean-output",
      "expected": "accepted-with-unavailable-source-and-replay-gaps"
    },
    { "case_id": "reuse-with-source-bytes", "classification": "malformed", "mutation": "retained-reuse-with-source-bytes", "expected": "rejected-clean-reuse-collapse" }
  ]
}
